Reference,Complete Reference
[12265] ZHENG JIAN-PING (2004),"[12265] ZHENG JIAN-PING, GRIFFIN W. L., O^REILLY S. Y., LU FENGXIANG, YU CHUN-MEI, ZHANG MING, LI HUIMIN:    U-PB AND HF-ISOTOPE ANALYSIS OF ZIRCONS IN MAFIC XENOLITHS FROM FUXIAN KIMBERLITES: EVOLUTION OF THE LOWER CRUST BENEATH THE NORTH CHINA CRATON    CONTRIB. MINERAL. PETROL. 148   [2004]  79-103    doi: 10.1007/s00410-004-0587-x"
[12361] ZHENG JIAN-PING (2006),"[12361] ZHENG JIAN-PING, GRIFFIN W. L., O^REILLY S. Y., YANG JINGSUI, ZHANG RUTH Y.:    A REFRACTORY MANTLE PROTOLITH IN AYOUNGER CONTINENTAL CRUST, EAST-CENTRAL CHINA: AGE AND COMPOSITION OF ZIRCON IN THE SULU ULTRAHIGH-PRESSURE PERIDOTITE    GEOLOGY 34   [2006]  705-708    doi: 10.1130/G22569.1"
[13876] ZHANG SHUAN-HONG (2009),"[13876] ZHANG SHUAN-HONG, ZHAO YUE, YANG ZHENYU, HE ZHE-FENG, WU HAI:    THE 1.35 GA DIABASE SILLS FROM THE NORTHERN CHINA CRATON: IMPLICATIONS FOR BREAKUP OF THE COLUMBIA (NUN) SUPERCONTINENT    EARTH PLANET. SCI. LETT. 288   [2009]  588-600    doi: 10.1016/j.epsl.2009.10.023"
[14448] SCHMITT A. K. (2010),"[14448] SCHMITT A. K., WETZEL F., COOPER KARI M., ZOU HAIBO, WÖRNER G.:    MAGMATIC LONGEVITY OF LAACHER SEE VOLCANO (EIFEL, GERMANY) INDICATED BY U-TH DATING OF INTRUSIVE CARBONATITES    J. PETROL. 51   [2010]  1053-1085    doi: 10.1093/petrology/egq011"
[15288] DONNELLY C. L. (2011),"[15288] DONNELLY C. L., GRIFFIN W. L., O^REILLY S. Y., PEARSON N. J., SHEE S. R.:    THE KIMBERLITES AND RELATED ROCKS OF THE KURUMAN KIMBERLITE PROVINCE, KAAPVAAL CRATON, SOUTH AFRICA    CONTRIB. MINERAL. PETROL. 161   [2011]  351-371    GeoReM-id: 6120   doi: 10.1007/s00410-010-0536-9"
[15798] STELTEN M. E. (2012),"[15798] STELTEN M. E., COOPER KARI M.:    CONSTRAINTS ON THE NATURE OF THE SUBVOLCANIC RESERVOIR AT SOUTH SISTER VOLCANO, OREGON FROM U-SERIES DATING COMBINED WITH SUB-CRYSTAL TRACE-ELEMENT ANALYSIS OF PLAGIOCLASE AND ZIRCON    EARTH PLANET. SCI. LETT. 313-314   [2012]  1-11    GeoReM-id: 6517   doi: 10.1016/j.epsl.2011.10.035"
[16410] NIKITINA L. P. (2012),"[16410] NIKITINA L. P., MARIN YU. B., SKUBLOV S. G., KOROLEV N. M., SALTYKOVA A. K., ZINCHENKO V. N., CHISSUPA H. M.:    U-PB AGE AND GEOCHEMISTRY OF ZIRCON FROM MANTLE XENOLITHS OF THE KATOKA AND KAT-115 KIMBERLITIC PIPES (REPUBLIC OF ANGOLA)    DOKL. EARTH SCI. 445   [2012]  840-844    doi: 10.1134/S1028334X12070069"
[16578] ZHENG JIAN-PING (2006),"[16578] ZHENG JIAN-PING, GRIFFIN W. L., O^REILLY S. Y., ZHANG MING, PEARSON N. J.:    ZIRCONS IN MANTLE XENOLITHS RECORD THE TRIASSIC YANGTZE-NORTH CHINA CONTINENTAL COLLISION    EARTH PLANET. SCI. LETT. 247   [2006]  130-142    doi: 10.1016/j.epsl.2006.05.011"
[16790] KITAJIMA K. (2012),"[16790] KITAJIMA K., USHIKUBO T., KITA N. T., MARUYAMA S., VALLEY J. W.:    RELATIVE RETENTION OF TRACE ELEMENT AND OXYGEN ISOTOPE RATIOS IN ZIRCON FROM ARCHEAN RHYOLITE, PANORAMA FORMATION, NORTH POLE DOME, PILBARA CRATON, WESTERN AUSTRALIA    CHEM. GEOL. 332-333   [2012]  102-115    GeoReM-id: 6773   doi: 10.1016/j.chemgeo.2012.09.019"
[17110] WANG QIANG (2012),"[17110] WANG QIANG, CHUNG SUN-LIN, LI XIAN-HUA, WYMAN D. A., LI ZHENG-XIANG, SUN WEI-DONG, QIU HUA-NING, LIU YONG-SHENG, ZHU YING-TANG:    CRUSTAL MELTING AND FLOW BENEATH NORTHERN TIBET: EVIDENCE FROM MID-MIOCENE TO QUATERNARY STRONGLY PERALUMINOUS RHYOLITES IN THE SOUTHERN KUNLUN RANGE    J. PETROL. 53   [2012]  2523-2566    GeoReM-id: 6971   doi: 10.1093/petrology/egs058"
[17292] PAMUKCU A. S. (2013),"[17292] PAMUKCU A. S., CARLEY T. L., GUALDA G. A. R., MILLER C. F., FERGUSON C. A.:    THE EVOLUTION OF THE PEACH SPRING GIANT MAGMA BODY: EVIDENCE FROM ACCESSORY MINERAL TEXTURES AND COMPOSITIONS, BULK PUMICE AND GLASS GEOCHEMISTRY, AND RHYOLITE-MELTS MODELING    J. PETROL. 54   [2013]  1109-1148    GeoReM-id: 7465   doi: 10.1093/petrology/egt007"
[17449] STELTEN M. E. (2013),"[17449] STELTEN M. E., COOPER KARI M., VAZQUEZ J. A., REID M. R., BARFOD G. H., WIMPENNY J. B., YIN QING-ZHU:    MAGMA MIXING AND THE GENERATION OF ISOTOPICALLY JUVENILE SILICIC MAGMA AT YELLOWSTONE CALDERA INFERRED FROM COUPLING 238U-230TH AGES WITH TRACE ELEMENTS AND HF AND O ISOTOPES IN ZIRCON AND PB ISOTOPES IN SANIDINE    CONTRIB. MINERAL. PETROL. 166   [2013]  587-613    GeoReM-id: 7740   doi: 10.1007/s00410-013-0893-2"
[18021] EL-BIALY M. Z. (2013),"[18021] EL-BIALY M. Z., ALI K. A.:    ZIRCON TRACE ELEMENT GEOCHEMICAL CONSTRAINTS ON THE EVOLUTION OF THE EDIACARAN (600-614) POST-COLLISIONAL DOKHAN VOLCANICS AND YOUNGER GRANITES OF SE SINAI, NE ARABIAN-NUBIAN SHIELD    CHEM. GEOL. 360-361   [2013]  54-73    doi: 10.1016/j.chemgeo.2013.10.009"
[18638] CAI KEDA (2014),"[18638] CAI KEDA, SUN MIN, XIAO WENJIAO, YUAN CHAO, ZHAO GUOCHUN, LONG XIAOPING, TUMURKHUU D., ZHOU KEFA:    PETROGENESIS OF LATE PALEOZOIC THOLEIITIC, NB-ENRICHED, CALC-ALKALINE AND ADAKITIC ROCKS IN SOUTHWESTERN MONGOLIA: IMPLICATIONS FOR INTRA-OCEANIC ARC EVOLUTION    LITHOS 202-203   [2014]  413-428    doi: 10.1016/j.lithos.2014.06.004"
[19206] COOMBS M. L. (2014),"[19206] COOMBS M. L., VAZQUEZ J. A.:    COGENETIC LATE PLEISTOCENE RHYOLITE AND CUMULATE DIORITES FROM AUGUSTINE VOLCANO REVEALED BY SIMS 238U-230TH DATING OF ZIRCON, AND IMPLICATIONS FOR SILICIC MAGMA GENERATION BY EXTRACTION FROM MUSH    GEOCHEMISTRY GEOPHYSICS GEOSYSTEMS 15   [2014]  4846-4865    doi: 10.10025/2014GC005589"
[19382] COLON D. P. (2015),"[19382] COLON D. P., BINDEMAN I. N., ELLIS B. S., SCHMITT A. K., FISHER C. M.:    HYDROTHERMAL ALTERATION AND MELTING OF THE CRUST DURING THE COLUMBIA RIVER BASALT-SNAKE RIVER PLAIN TRANSITION AND THE ORIGIN OF LOW-D18O RHYOLITES OF THE CENTRAL SNAKE RIVER PLAIN    LITHOS 224-225   [2015]  310-323    doi: 10.1016/J.LITHOS.2015.02.022"
[19470] DEY S. (2015),"[19470] DEY S., NANDY J., CHOUDHARY A. K., LIU YONG-SHENG, ZONG KEQING:    NEOARCHAEAN CRUSTAL GROWTH BY COMBINED ARC-PLUME ACTION: EVIDENCE FROM THE KADIRI GREENSTONE BELT, EASTERN DHARWAR CRATON, INDIA    SPEC. PUBL. GEOL. SOC. LONDON 389   [2015]  135-163    doi: 10.1144/SP389.3"
[19732] LIU LEI (2015),"[19732] LIU LEI, YANG XIAO-YONG, PANDIT M. K., AULBACH S., ZHOU HONGYING, GENG JIANZHEN, SUN WEI-DONG:    NEOPROTEROZOIC INTRAPLATE CRUSTAL ACCRETION ON THE NORTHERN MARGIN OF THE YANGTZE BLOCK: EVIDENCE FROM GEOCHEMISTRY, ZIRCON SHRIMP U-PB DATING AND HF ISOTOPES FROM THE FUCHASHAN COMPLEX    PREC. RESEARCH 268   [2015]  97-114    GeoReM-id: 8727   doi: 10.1016/j.precamres.2015.07.004"
[19775] STELTEN M. E. (2015),"[19775] STELTEN M. E., COOPER KARI M., VAZQUEZ J. A., CALVERT A. T., GLESSNER J. G.:    MECHANISMS AND TIMESCALES OF GENERATING ERUPTIBLE RHYOLITIC MAGMAS AT YELLOWSTONE CALDERA FROM ZIRCON AND SANIDINE GEOCHRONOLOGY AND GEOCHEMISTRY    J. PETROL. 56   [2015]  1607-1642    GeoReM-id: 8626   doi: 10.1093/petrology/egv047"
[19822] FARAMARZI N. S. (2015),"[19822] FARAMARZI N. S., AMINI S., SCHMITT A. K., HASSANZADEH J., BORG G., MCKEEGAN KEVIN D., RAZAVI S. M. H., FAGNY S. M.:    GEOCHRONOLOGY AND GEOCHEMISTRY OF RHYOLITES FROM HORMUZ ISLAND, SOUTHERN IRAN: A NEW RECORD OF CADOMIAN ARC MAGMATISM IN THE HORMUZ FORMATION    LITHOS 236-237   [2015]  203-211    doi: 10.1016/j.lithos.2015.08.017"
[20418] ZHAO LIANG (2016),"[20418] ZHAO LIANG, GUO FENG, FAN WEI-MING, ZHANG QINGWEN, WU YANGMING, LI JINGYAN, YAN WEN:    EARLY CRETACEOUS POTASSIC VOLCANIC ROCKS IN THE JIANGNAN OROGENIC BELT, EAST CHINA: CRUSTAL MELTING IN RESPONSE TO SUBDUCTION OF THE PACIFIC-IZANAGI RIDGE?    CHEM. GEOL. 437   [2016]  30-43    GeoReM-id: 9211   doi: 10.1016/j.chemgeo.2016.05.011"
[20439] VELASCO-TAPIA F. (2016),"[20439] VELASCO-TAPIA F., MARTINEZ-PACO M., IRIONDO A., OCAMPO-DIAZ Y. Z. E., CRUZ-GAMEZ E. M., RAMOS-LEDEZMA A., ANDAVERDE J. A., OSTROOUMOV M., MASUCH D.:    ALTERED VOLCANIC ASH LAYERS OF THE LATE CRETACEOUS SAN FELIPE FORMATION, SIERRA MADRE ORIENTAL (NORTHEASTERN MEXICO): U-PB GEOCHRONOLOGY, PROVENANCE AND TECTONIC SETTING    J. S. AMER. EARTH SCI. 70   [2016]  18-35    doi: 10.1016/j.jsames.2016.04.010"
[20477] WANG RUI (2016),"[20477] WANG RUI, COLLINS W. J., WEINBERG R. F., LI JINXIANG, LI QIU-YUN, HE WEN-YAN, RICHARDS J. P., HOU ZENGQIAN, ZHOU LI-MIN, STERN R. A.:    XENOLITHS IN ULTRAPOTASSIC VOLCANIC ROCKS IN THE LHASA BLOCK: DIRECT EVIDENCE FOR CRUST-MANTLE MIXING AND METAMORPHISM IN THE DEEP CRUST    CONTRIB. MINERAL. PETROL. 171 (62)  [2016]     doi: 10.1007/s00410-016-1272-6"
[20523] PADILLA A. J. (2016),"[20523] PADILLA A. J., MILLER C. F., CARLEY T. L., ECONOMOS R. C., SCHMITT A. K., COBLE M. A., WOODEN J. L., FISHER C. M., VERVOORT J. D., HANCHAR J. M.:    ELUCIDATING THE MAGMATIC HISTORY OF THE AUSTURHORN SILICIC INTRUSIVE COMPLEX (SOUTHEAST ICELAND) USING ZIRCON ELEMENTAL AND ISOTOPIC GEOCHEMISTRY AND GEOCHRONOLOGY    CONTRIB. MINERAL. PETROL. 171 (69)  [2016]     doi: 10.1007/s00410-016-1279-z"
[20769] ZINCONE S. A. (2016),"[20769] ZINCONE S. A., OLIVEIRA E. P., LAURENT O., ZHANG HONG, ZHAI MINGGUO:    3.30 GA HIGH-SILICA INTRAPLATE VOLCANIC-PLUTONIC SYSTEM OF THE GAVIAO BLOCK, SAO FRANCISCO CRATON, BRAZIL: EVIDENCE OF AN INTRACONTINENTAL RIFT FOLLOWING THE CREATION OF INSULATING CONTINENTAL CRUST    LITHOS 266-267   [2016]  414-434    doi: 10.1016/j.lithos.2016.10.011"
[20920] ROBINSON F. A. (2015),"[20920] ROBINSON F. A., FODEN J. D., COLLINS A. S.:    ZIRCON GEOCHEMICAL AND GEOCHRONOLOGICAL CONSTRAINTS ON CONTAMINATED AND ENRICHED MANTLE SOURCES BENEATH THE ARABIAN SHIELD, SAUDI ARABIA    J. GEOL. 123   [2015]  463-489    doi: 10.1086/683192"
[21619] DENG KE (2018),"[21619] DENG KE, LI QIUGEN, CHEN YANJING, ZHANG CHENG, ZHU XUEFENG, XU QIANGWEI:    GEOCHRONOLOGY, GEOCHEMISTRY AND SR-ND-PB-HF ISOTOPES OF THE EARLY JURASSIC GRANODIORITE FROM THE SANKUANGGOU INTRUSION, HEILONGJIANG PROVINCE, NORTHEASTERN CHINA: PETROGENESIS AND GEODYNAMIC IMPLICATIONS    LITHOS 296-298   [2018]  113-128    GeoReM-id: 11055   doi: 10.1016/j.lithos.2017.10.016"
[21677] TERENTIEV R. A. (2018),"[21677] TERENTIEV R. A., SAVKO K. A., SANTOSH M.:    POST-COLLISIONAL TWO-STAGE MAGMATISM IN THE EAST SARMATIAN OROGEN, EAST EUROPEAN CRATON: EVIDENCE FROM THE OLKHOVSKY RING COMPLEX    J. GEOL. SOC. LONDON 175   [2018]  86-99    doi: 10.1144/jgs2017-017"
[22019] HEINONEN A. P. (2017),"[22019] HEINONEN A. P., RÄMÖ O. T., MÄNTTÄRI I., ANDERSEN T., LARJAMO K.:    ZIRCON AS A PROXY FOR THE MAGMATIC EVOLUTION OF PROTEROZOIC FERROAN GRANITES; THE WIBORG RAPAKIVI GRANITE BATHOLITH, SE FINLAND    J. PETROL. 58   [2017]  2493-2517    GeoReM-id: 10972   doi: 10.1093/petrology/egy014"
[22179] TROCH J. (2018),"[22179] TROCH J., ELLIS B. S., SCHMITT A. K., BOUVIER A.-S., BACHMANN O.:    THE DARK SIDE OF ZIRCON: TEXTURAL, AGE, OXYGEN ISOTOPIC AND TRACE ELEMENT EVIDENCE OF FLUID SATURATION IN THE SUBVOLCANIC RESERVOIR OF THE ISLAND PARK-MOUNT JACKSON RHYOLITE, YELLOWSTONE (USA)    CONTRIB. MINERAL. PETROL. 173 (54)  [2018]     GeoReM-id: 11592   doi: 10.1007/s00410-018-1481-2"
[22205] TKACHEVA D. A. (2018),"[22205] TKACHEVA D. A., MIKHALSKY E. V., SUSHCHEVSKAYA N. M., KUNAKKUZIN E. L., SKUBLOV S. G., SERGEEV S. A.:    AGE AND GEOCHEMISTRY OF THE CAPE BURKS GABBROIDS (RUSSKAYA STATION AREA, WEST ANTARCTICA)    GEOCHEM. INT. 56   [2018]  628-650    doi: 10.1134/S001670291807011X"
[22208] LI HUAN (2018),"[22208] LI HUAN, DAVIES H., EVANS N. J., JIANG WEI-CHENG, ZHOU ZHE-KAI:    ZIRCON GEOCHRONOLOGY AND GEOCHEMISTRY OF THE XIANGHUALING A-TYPE GRANITIC ROCKS: INSIGHTS INTO MULTI-STAGE SN-POLYMETALLIC MINERALIZATION IN SOUTH CHINA    LITHOS 312-313   [2018]  1-20    GeoReM-id: 11078   doi: 10.1016/j.lithos.2018.05.001"
[22243] LIU LIANG (2018),"[22243] LIU LIANG, HU RUIZHONG, ZHONG HONG, TANG YAN-WEN, YANG JIE-HUA, LI ZHEN, ZHAO JIAO-LONG, SHEN NENG-PING:    NEW CONSTRAINTS ON THE CRETACEOUS GEODYNAMICS OF PALEO-PACIFIC PLATE SUBDUCTION: INSIGHTS FROM THE XIAOJIANG-BEIZHANG GRANITOIDS, ZHEJIANG PROVINCE, SOUTHEAST CHINA    LITHOS 314-315   [2018]  382-399    GeoReM-id: 11174   doi: 10.1016/j.lithos.2018.06.020"
[22738] SAVKO K. A. (2019),"[22738] SAVKO K. A., SAMSONOV A. V., KHOLINA N. V., LARIONOV A. N., ZAITSEVA M. V., KORISH E. K., BAZIKOV N. S., TERENTIEV R. A.:    2.6 GA HIGH-SI RHYOLITES AND GRANITES IN THE KURSK DOMAIN, EASTERN SARMATIA: PETROLOGY AND APPLICATION FOR THE ARCHAEAN PALAEOCONTINENTAL CORRELATIONS    PREC. RESEARCH 322   [2019]  170-192    doi: 10.1016/j.precamres.2019.01.006"
[22767] KAY S. M. (2019),"[22767] KAY S. M., JICHA B. R., CITRON G. L., KAY R. W., TIBBETTS A. K., RIVERA T. A.:    THE CALC-ALKALINE HIDDEN BAY AND KAGALASKA PLUTONS AND THE CONSTRUCTION OF THE CENTRAL ALEUTIAN OCEANIC ARC CRUST    J. PETROL. 60   [2019]  393-49    GeoReM-id: 11837   doi: 10.1093/petrology/egy119"
[22969] CISNEROS DE LEON A. (2019),"[22969] CISNEROS DE LEON A., SCHMITT A. K.:    INTRUSIVE REAWAKENING OF EL CHICHON VOLCANO PRIOR TO ITS HOLOCENE ERUPTIVE HYPERACTIVITY    J. VOLCANOL. GEOTHERM. RES. 377   [2019]  53-68    doi: 10.1016/j.jvolgeores.2019.04.004"
[22995] SMITH W. D. (2019),"[22995] SMITH W. D., DARLING W. D., BULLEN D. S., LASALLE S., PEREIRA I., MOREIRA H., ALLEN C. J., TAPSTER S.:    ZIRCON PERSPECTIVES ON THE AGE AND ORIGIN OF EVOLVED S-TYPE GRANITES FROM THE CORNUBIAN BATHOLITH, SOUTHWEST ENGLAND    LITHOS 336-337   [2019]  14-26    doi: 10.1016/j.lithos.2019.03.025"
[22996] DOU JINGZHAO (2019),"[22996] DOU JINGZHAO, SIEBEL W., HE JIAN-FENG, CHEN FUKUN:    DIFFERENT MELTING CONDITIONS AND PETROGENESIS OF PERALUMINOUS GRANITES IN WESTERN QINLING, CHINA, AND TECTONIC IMPLICATIONS    LITHOS 336-337   [2019]  97-111    doi: 10.1016/j.lithos.2019.04.003"
[23058] JUAREZ-ZUNIGA S. (2019),"[23058] JUAREZ-ZUNIGA S., SOLARI L. A., ORTEGA-OBREGON C.:    ORDOVICIAN TO SILURIAN IGNEOUS ROCKS IN SOUTHERN MEXICO AND CENTRAL AMERICA: GEOCHRONOLOGIC AND ISOTOPIC CONSTRAINTS ON PALEOGEOGRAPHIC MODELS    J. S. AMER. EARTH SCI. 93   [2019]  462-479    doi: 10.1016/j.jsames.2019.04.023"
[23131] VILALVA F. C. J. (2019),"[23131] VILALVA F. C. J., SIMONETTI A., VLACH S. R. F.:    INSIGHTS ON THE ORIGIN OF THE GRACIOSA A-TYPE GRANITES AND SYENITES (SOUTHERN BRAZIL) FROM ZIRCON U-PB GEOCHRONOLOGY, CHEMISTRY, AND HF AND O ISOTOPE COMPOSITIONS    LITHOS 340-341   [2019]  20-33    GeoReM-id: 12132   doi: 10.1016/j.lithos.2019.05.001"
[23184] WANG XIN-SONG (2019),"[23184] WANG XIN-SONG, BI XIANWU, CHEN YOU-WEI, PAN LI-CHUAN, XU LEI-LUO:    CRYSTAL FRACTIONATION OF CONTAMINATED MELTS AND RE-MELTING OF NEWLY UNDERPLATED BASALTIC CRUST GENERATED LATE TRIASSIC ANDESITIC AND DIORITIC INTRUSIONS IN THE SOUTHERN YIDUN TERRANE, SW CHINA    LITHOS 342-343   [2019]  135-151    GeoReM-id: 12113   doi: 10.1016/j.lithos.2019.05.033"
[23188] JANOUSEK V. (2019),"[23188] JANOUSEK V., HOLUB F. V., VERNER K., COPJAKOVA R., GERDES A., HORA J. M., KOSLER J., TYRRELL S.:    TWO-PYROXENE SYENITOIDS FROM THE MOLDANUBIAN ZONE OF THE BOHEMIAN MASSIF: PECULIAR MAGMAS DERIVED FROM A STRONGLY ENRICHED LITHOSPHERIC MANTLE SOURCE    LITHOS 342-343   [2019]  239-262    doi: 10.1016/j.lithos.2019.05.028"
[23434] ELLIS B. S. (2019),"[23434] ELLIS B. S., SCHMITZ M. D., HILL M.:    RECONSTRUCTING A SNAKE RIVER PLAIN ‘SUPER-ERUPTION’ VIA COMPOSITIONAL FINGERPRINTING AND HIGH-PRECISION U/PB ZIRCON GEOCHRONOLOGY    CONTRIB. MINERAL. PETROL. 174 (101)  [2019]     doi: 10.1007/s00410-019-1641-z"
[23460] BANIK T. J. (2018),"[23460] BANIK T. J., MILLER C. F., FISHER C. M., COBLE M. A., VERVOORT J. D.:    MAGMATIC-TECTONIC CONTROL ON THE GENERATION OF SILICIC MAGMAS IN ICELAND: CONSTRAINTS FROM HAFNARFJALL-SKARÐSHEIÐI VOLCANO    LITHOS 318-319   [2018]  326-339    doi: 10.1016/j.lithos.2018.08.022"
[23693] LEVASHOVA E. V. (2020),"[23693] LEVASHOVA E. V., NOSKOV D. A., SKUBLOV S. G.:    TRACE ELEMENT GEOCHEMISTRY OF ZIRCONS FROM THE EARLY PALEOZOIC GRANITES OF THE ANGARA-VITIM BATHOLITH    GEOCHEM. INT. 58   [2020]  235-243    doi: 10.1134/S0016702920020068"
[23776] WANG JIAN (2020),"[23776] WANG JIAN, SU YUPING, ZHENG JIAN-PING, BELOUSOVA E. A., GRIFFIN W. L., ZHOU XIANG, DAI HONG-KUN:    HIDDEN EOARCHEAN CRUST IN THE SOUTHWESTERN CENTRAL ASIAN OROGENIC BELT    LITHOS 360-361 (105437)  [2020]     doi: 10.1016/j.lithos.2020.105437"
[23791] XIANG LU (2020),"[23791] XIANG LU, WANG RU-CHENG, ROMER R. L., CHE XUDONG, HU HUAN, XIE LEI, TIAN ENNONG:    NEOPROTEROZOIC NB-TA-W-SN BEARING TOURMALINE LEUCOGRANITE IN THE WESTERN PART OF JIANGNAN OROGEN: IMPLICATIONS FOR EPISODIC MINERALIZATION IN SOUTH CHINA    LITHOS 360-361 (105450)  [2020]     doi: 10.1016/j.lithos.2020.105450"
[23933] XIE ZHIPENG (2020),"[23933] XIE ZHIPENG, XUE CHUAN-DONG, IVKO B., XIANG KUN, XIN DI:    PETROGENESIS AND GEODYNAMIC IMPLICATIONS OF EARLY CRETACEOUS HIGHLY FRACTIONATED LEUCOGRANITES IN THE NORTHERN LANPING-SIMAO TERRANE, EASTERN TIBETAN PLATEAU    J. ASIAN EARTH SCI. 197 (104340)  [2020]     doi: 10.1016/j.jseaes.2020.104340"
[24019] GUDELIUS D. (2020),"[24019] GUDELIUS D., ZEH A., WILSON A. H.:    ZIRCON FORMATION IN MAFIC AND FELSIC ROCKS OF THE BUSHVELD COMPLEX, SOUTH AFRICA: CONSTRAINTS FROM COMPOSITION, ZONING, TH/U RATIOS, MORPHOLOGY, AND MODELLING    CHEM. GEOL. 546 (119647)  [2020]     doi: 10.1016/j.chemgeo.2020.119647"
[24056] ROTTIER B. (2020),"[24056] ROTTIER B., AUDETAT A., KODERA P., LEXA J.:    MAGMATIC EVOLUTION OF THE MINERALIZED ŠTIAVNICA VOLCANO (CENTRAL SLOVAKIA): EVIDENCE FROM THERMOBAROMETRY, MELT INCLUSIONS, AND SULFIDE INCLUSIONS    J. VOLCANOL. GEOTHERM. RES. 401 (106967)  [2020]     doi: 10.1016/j.jvolgeores.2020.106967"
[24081] MOLINA P. G. (2020),"[24081] MOLINA P. G., PARADA M. A., MA CHANGQIAN:    ZIRCON INHERITANCE FROM LONG-LIVED SOURCES OF LATE TRIASSIC POST-OROGENIC PLUTONS, HIGH ANDES, CENTRAL CHILE (~30°S): MAGMATIC FEEDBACKS AND PETROGENETIC IMPLICATIONS    LITHOS 370-371 (105662)  [2020]     doi: 10.1016/j.lithos.2020.105662"
[24219] ZHANG HONGRUI (2020),"[24219] ZHANG HONGRUI, YANG TIANNAN, HOU ZENGQIAN, WANG YANG:    MAGMATIC EXPRESSION OF TECTONIC TRANSITION FROM OCEANIC SUBDUCTION TO CONTINENTAL COLLISION: INSIGHTS FROM THE MIDDLE TRIASSIC RHYOLITES OF THE NORTH QIANGTANG BLOCK    GONDWANA RES. 87   [2020]  67-82    doi: 10.1016/j.gr.2020.05.012"
[24242] GUDELIUS D. (2020),"[24242] GUDELIUS D., PEASE V. L., ALMEEV R. R., WILSON A. H., FISCHER L. A., SCHMITT A. K.:    ZIRCON MELT INCLUSIONS IN MAFIC AND FELSIC ROCKS OF THE BUSHVELD COMPLEX - CONSTRAINTS FOR ZIRCON CRYSTALLIZATION TEMPERATURES AND PARTITION COEFFICIENTS    GEOCHIM. COSMOCHIM. ACTA 289   [2020]  158-181    doi: 10.1016/j.gca.2020.08.027"
[24272] DOMNICK U. (2020),"[24272] DOMNICK U., COOK N. J., CIOBANU C. L., COURTNEY-DAVIES L., DMITRIEVA M. T., VERDUGO-IHL M. R., XU JING, KEYSER W., SLATTERY A., KENNEDY A. K., BLUCK R.:    MICRON- TO NANOSCALE CHARACTERISATION AND U-PB GEOCHRONOLOGY OF ZIRCON FROM GRANITES OF THE SAMPHIRE PLUTON, SOUTH AUSTRALIA    PREC. RESEARCH 350 (105924)  [2020]     doi: 10.1016/j.precamres.2020.105924"
[24376] WANG JIAN (2020),"[24376] WANG JIAN, SU YUPING, ZHENG JIAN-PING, BELOUSOVA E. A., CHEN MING, DAI HONG-KUN, ZHOU LIANG:    SLAB ROLL-BACK TRIGGERED BACK-ARC EXTENSION SOUTH OF THE PALEO-ASIAN OCEAN: INSIGHTS FROM DEVONIAN MORB-LIKE DIABASE DYKES FROM THE CHINESE ALTAI    LITHOS 376-377 (105790)  [2020]     doi: 10.1016/j.lithos.2020.105790"
[24386] DESSOUKY O. K. (2021),"[24386] DESSOUKY O. K., SUN WEI-DONG, IBRAHIM W. S., ALI H. H., HASSAN M. M., LI CONG-YING, OMRAN A. A.:    NEW INSIGHTS INTO CRYOGENIAN ARC GRANITOIDS HOSTING TH-U MINERALIZED EDIACARAN SYENOGRANITE DIKES, RA’S ABDAH AREA IN THE NORTHERN EGYPTIAN NUBIAN SHIELD: CONSTRAINTS FROM U-PB AGES AND ZIRCON GEOCHEMISTRY    PREC. RESEARCH 352 (105986)  [2021]     doi: 10.1016/j.precamres.2020.105986"
[24442] DOU JINGZHAO (2021),"[24442] DOU JINGZHAO, HUANG XIGUANG, CHEN FUKUN:    SUCCESSIVE MAGMA MIXING IN DEEP-SEATED MAGMA CHAMBERS RECORDED IN ZIRCON FROM MAFIC MICROGRANULAR ENCLAVES IN THE TRIASSIC MISHULING GRANITIC PLUTON, WESTERN QINLING, CENTRAL CHINA    J. S. AMER. EARTH SCI. 105 (104656)  [2021]     doi: 10.1016/j.jseaes.2020.104656"
[24465] LIU BIAO (2021),"[24465] LIU BIAO, WU JING-HUA, LI HUAN, MATHUR R., WU QIAN-HONG, ZHENG HAN, JIANG JIANG-BO:    LATE PALEOZOIC TECTONIC EVOLUTION OF THE KANGGUER SHEAR ZONE AND YAMANSU ARC BELT, EASTERN TIANSHAN (NW CHINA): CONSTRAINTS FROM STRUCTURE, PETROGENESIS AND GEOCHRONOLOGY OF GRANITOIDS    LITHOS 380-381 (105821)  [2021]     doi: 10.1016/j.lithos.2020.105821"
[24485] LIU CHAOHUI (2021),"[24485] LIU CHAOHUI, ZHAO GUOCHUN, LIU FULAI, XU WANG:    COEXISTENCE OF A- AND I-TYPE GRANITES IN THE LÜLIANG COMPLEX: TECTONIC IMPLICATIONS FOR THE MIDDLE PALEOPROTEROZOIC TRANS-NORTH CHINA OROGEN, NORTH CHINA CRATON    LITHOS 380-381 (105875)  [2021]     doi: 10.1016/j.lithos.2020.105875"
[24494] KONG HUA (2021),"[24494] KONG HUA, WU JING-HUA, LI HUAN, CHEN SHE-FA, LIU BIAO, WANG GAO:    EARLY PALEOZOIC TECTONIC EVOLUTION OF THE SOUTH CHINA BLOCK: CONSTRAINTS FROM GEOCHEMISTRY AND GEOCHRONOLOGY OF GRANITOIDS IN HUNAN PROVINCE    LITHOS 380-381 (105891)  [2021]     doi: 10.1016/j.lithos.2020.105891"
[24509] REHMAN H.-U. (2021),"[24509] REHMAN H.-U., LEE HAO-YANG, KHAN T., CHUNG SUN-LIN, JAN M. Q., ZAFAR T., MURATA M.:    PETROGENETIC SOURCE AND TECTONIC EVOLUTION OF THE NEOPROTEROZOIC NAGAR PARKAR IGNEOUS COMPLEX GRANITOIDS: EVIDENCE FROM ZIRCON HF ISOTOPE AND TRACE ELEMENT GEOCHEMISTRY    PREC. RESEARCH 354 (106047)  [2021]     doi: 10.1016/j.precamres.2020.106047"
[24558] ZHU JIANG (2021),"[24558] ZHU JIANG, ZHANG ZHAOCHONG, SANTOSH M., TAN SHU-CHENG, JIN ZILIANG:    SUBMARINE BASALTIC ERUPTIONS ACROSS THE GUADALUPIAN-LOPINGIAN TRANSITION IN THE EMEISHAN LARGE IGNEOUS PROVINCE: IMPLICATION FOR END-GUADALUPIAN EXTINCTION OF MARINE BIOTA    GONDWANA RES. 92   [2021]  228-238    doi: 10.1016/j.gr.2020.12.025"
[24598] SADIQ I. (2021),"[24598] SADIQ I., PAN FABIN, ZHANG HONGFEI, LI CHUN-FENG, LUO BI-JI, ARIF M.:    RECYCLING OF SUBDUCTED INDIAN CONTINENTAL CRUST AND ITS SIGNIFICANCE ON POST-COLLISIONAL ULTRAPOTASSIC MAGMATISM IN SOUTHWESTERN TIBET    CONTRIB. MINERAL. PETROL. 176 (20)  [2021]     doi: 10.1007/s00410-021-01779-4"
[24610] WALL C. J. (2021),"[24610] WALL C. J., HANSON R. E., SCHMITZ M. D., PRICE J. D., DONOVAN R. N., BORO J. R., ESCHBERGER A. M., TOEWS C. E.:    INTEGRATING ZIRCON TRACE-ELEMENT GEOCHEMISTRY AND HIGH-PRECISION U-PB ZIRCON GEOCHRONOLOGY TO RESOLVE THE TIMING AND PETROGENESIS OF THE LATE EDIACARAN-CAMBRIAN WICHITA IGNEOUS PROVINCE, SOUTHERN OKLAHOMA AULACOGEN, USA    GEOLOGY 49   [2021]  268-272    doi: 10.1130/G48140.1"
[24624] BINDEMAN I. N. (2021),"[24624] BINDEMAN I. N., COLON D. P., WOTZLAW J.-F., STERN R., CHIARADIA M., GUILLONG M.:    YOUNG SILICIC MAGMATISM OF THE GREATER CAUCASUS, RUSSIA, WITH IMPLICATION FOR ITS DELAMINATION ORIGIN BASED ON ZIRCON PETROCHRONOLOGY AND THERMOMECHANICAL MODELING    J. VOLCANOL. GEOTHERM. RES. 412 (107173)  [2021]     doi: 10.1016/j.jvolgeores.2021.107173"
[24633] DOROSHKEVICH A. G. (2021),"[24633] DOROSHKEVICH A. G., SHARYGIN V. V., BELOUSOVA E. A., IZBRODIN I. A., PROKOPYEV I. R.:    ZIRCON FROM THE CHUKTUKON ALKALINE ULTRAMAFIC CARBONATITE COMPLEX (CHADOBETS UPLIFT, SIBERIAN CRATON) AS EVIDENCE OF SOURCE HETEROGENEITY    LITHOS 382-383 (105957)  [2021]     doi: 10.1016/j.lithos.2020.105957"
[24637] HUANG XIGUANG (2021),"[24637] HUANG XIGUANG, DOU JINGZHAO, WU GUANGHUI, HE JUN, SIEBEL W., CHEN FUKUN:    SOURCE ROCKS CONTROL THE GEOCHEMICAL DIVERSITY OF GRANITE: THE LINCANG PLUTON IN THE WESTERN YUNNAN TETHYAN BELT, SW CHINA    LITHOS 382-383 (105950)  [2021]     doi: 10.1016/j.lithos.2020.105950"
[24690] JARA J. J. (2021),"[24690] JARA J. J., BARRA F., REICH M., MORATA D., LEISEN M., ROMERO R.:    GEOCHRONOLOGY AND PETROGENESIS OF INTRUSIVE ROCKS IN THE COASTAL CORDILLERA OF NORTHERN CHILE: INSIGHTS FROM ZIRCON U-PB DATING AND TRACE ELEMENT GEOCHEMISTRY    GONDWANA RES. 93   [2021]  48-72    doi: 10.1016/j.gr.2021.01.007"
[24759] GUO CHUNLI (2020),"[24759] GUO CHUNLI, WILDE S. A., HENDERSON R. A., LI QIULI, YIN BING:    COGENETIC DYKES THE KEY TO IDENTIFYING DIVERSE MAGMA BATCHES IN THE ASSEMBLY OF GRANITIC PLUTONS    J. PETROL. 61 (EGAA105)  [2020]     doi: 10.1093/petrology/egaa105"
